{
  "schema_version": 1,
  "authorization_id": "auth-fixture-disabled",
  "strategy_id": "fixture-multifactor",
  "allowed_markets": [
    "US"
  ],
  "allowed_symbols_or_universe": [
    "fixture-liquid-equities"
  ],
  "maximum_capital": 10000.0,
  "maximum_strategy_allocation": 0.1,
  "maximum_single_position_exposure": 0.02,
  "maximum_daily_loss": 100.0,
  "maximum_drawdown": 0.05,
  "maximum_order_frequency": 0,
  "outside_regular_hours_permission": false,
  "parameter_version": 1,
  "valid_from": "2026-01-01T00:00:00Z",
  "expires_at": "2026-01-01T00:00:01Z",
  "enabled": false
}
